{
  "schemaVersion": 1,
  "frames": 64,
  "sampleFrames": [
    1,
    16,
    24,
    32,
    40,
    48,
    56,
    64
  ],
  "camera": [
    {
      "frame": 1,
      "position": [
        0,
        1.8,
        6.5
      ],
      "target": [
        0,
        0.8,
        0
      ]
    }
  ],
  "objectName": "Emitter",
  "objectTranslation": [
    {
      "frame": 1,
      "translation": [
        -1,
        0,
        0
      ]
    },
    {
      "frame": 32,
      "translation": [
        1,
        0,
        0
      ]
    },
    {
      "frame": 48,
      "translation": [
        1,
        0,
        0
      ]
    },
    {
      "frame": 64,
      "translation": [
        -1,
        0,
        0
      ]
    }
  ]
}
