{
  "schemaVersion": 1,
  "frames": 64,
  "sampleFrames": [
    25,
    26,
    27,
    28,
    29,
    30,
    31,
    32,
    33,
    34,
    35,
    36,
    37,
    38,
    39,
    40,
    64
  ],
  "camera": [
    {
      "frame": 1,
      "position": [
        -0.35,
        1.8,
        6.5
      ],
      "target": [
        -0.35,
        0.8,
        0
      ]
    },
    {
      "frame": 64,
      "position": [
        0.35,
        1.8,
        6.5
      ],
      "target": [
        0.35,
        0.8,
        0
      ]
    }
  ]
}
