{
  "schemaVersion": 1,
  "frames": 64,
  "sampleFrames": [
    1,
    16,
    32,
    48,
    64
  ],
  "camera": [
    {
      "frame": 1,
      "position": [
        0,
        1.8,
        6.5
      ],
      "target": [
        0,
        0.8,
        0
      ]
    }
  ],
  "bimTranslation": [
    {
      "frame": 1,
      "translation": [
        -0.5,
        0,
        0
      ]
    },
    {
      "frame": 32,
      "translation": [
        0.5,
        0,
        0
      ]
    },
    {
      "frame": 64,
      "translation": [
        0,
        0,
        0
      ]
    }
  ]
}
